"id","title","date","tag","excerpt","body","published"
"location-longue-duree-maroc-entreprises-2026","Location longue durée au Maroc : pourquoi les entreprises choisissent la LLD et comment s'y adapter","05/04/2026","Location","La location longue durée séduit de plus en plus d'entreprises marocaines. Pour les agences, c'est un modèle stable mais qui demande une gestion différente de la courte durée.","La location longue durée (LLD) connaît une croissance notable au Maroc portée par des entreprises qui préfèrent externaliser leur mobilité plutôt qu'immobiliser des capitaux dans l'achat de véhicules. Pour une agence de location, proposer des contrats de 12 à 36 mois offre une visibilité sur les revenus et réduit les fluctuations saisonnières.

Mais la LLD n'est pas simplement une location courte durée étalée dans le temps. Elle implique des contrats détaillés avec kilométrage annuel défini, conditions d'entretien précisées, procédures de remplacement en cas de panne et modalités de sortie anticipée. Un contrat LLD mal rédigé devient une source de litige à long terme.

La tarification LLD doit intégrer le coût total de possession sur la durée du contrat : amortissement, assurance, vignettes, entretien prévisible. Les agences qui sous-évaluent ces coûts signent des contrats rentables sur le papier mais déficitaires dans la réalité, surtout quand le véhicule subit plus d'usure que prévu.

INVOOffice gère les contrats LLD avec suivi du kilométrage mensuel, alertes de dépassement, facturation récurrente automatique et tableaux de rentabilité par contrat pour les agences de location marocaines qui développent cette activité.",""
"marketing-agence-location-maroc-visibilite-2026","Gagner en visibilité pour une agence de location de voitures au Maroc : canaux et stratégies 2026","05/04/2026","Stratégie","Les agences de location marocaines qui misent sur le digital et les partenariats locaux attirent plus de clients que celles qui attendent la clientèle de passage. Les canaux qui fonctionnent.","La clientèle de passage s'est déplacée en ligne. En 2026, un touriste ou un voyageur d'affaires cherche d'abord une agence de location sur Google ou via une plateforme avant de s'arrêter au hasard. Une agence sans présence numérique — pas de fiche Google My Business, pas de site, pas d'avis clients — laisse le terrain à ses concurrents.

La fiche Google My Business est le point de départ minimal : photos de la flotte, horaires, numéro de contact, et surtout des réponses soignées aux avis clients. Les entreprises qui répondent — même aux mauvais avis — génèrent plus de confiance que celles qui ignorent les commentaires. C'est un signal fort pour les moteurs de recherche et pour les clients potentiels.

Les partenariats locaux — avec hôtels, agences de voyage, riads et entreprises locales — représentent une source de clientèle régulière souvent sous-exploitée. Une commission de recommandation bien structurée motive les partenaires sans complexifier la gestion. C'est un canal de croissance à coût maîtrisé.

INVOOffice facilite la gestion opérationnelle qui libère du temps pour le développement commercial : moins de temps passé à gérer les papiers, plus de temps pour soigner les clients et développer les partenariats au Maroc.",""
"ouvrir-restaurant-maroc-etapes-administratives-2026","Ouvrir un restaurant au Maroc en 2026 : démarches administratives et obligations légales","05/04/2026","Restaurant","Créer un restaurant ou un café au Maroc demande de suivre des étapes précises : autorisation communale, déclarations fiscales, normes sanitaires. Le guide pour démarrer légalement.","Ouvrir un restaurant au Maroc, c'est naviguer entre plusieurs administrations simultanément : la commune pour l'autorisation d'exploitation, la Direction des Impôts pour l'inscription fiscale et l'ICE, et les services sanitaires pour les autorisations d'hygiène. Ignorer l'une de ces étapes expose à des amendes ou à une fermeture administrative.

L'autorisation communale d'exploitation est souvent la plus longue à obtenir. Elle dépend du classement de la zone, de la conformité du local aux normes ERP (Etablissements Recevant du Public) et, dans certaines communes, d'une commission de sécurité. Prévoir 4 à 8 semaines pour cette étape, et ne pas attendre la dernière semaine avant l'ouverture.

Les obligations sanitaires sont souvent sous-estimées par les premiers restaurateurs. Formation HACCP pour le personnel manipulant des aliments, certificats sanitaires des locaux, traçabilité des fournisseurs : la Direction de l'Hygiène peut demander ces documents lors d'une visite inopinée.

INVOOffice accompagne les nouveaux restaurateurs marocains dès l'ouverture avec une gestion de caisse conforme, une facturation TVA correctement paramétrée et un archivage structuré des documents commerciaux.",""
"menu-engineering-restaurant-maroc-2026","Menu engineering pour restaurant marocain : identifier les plats qui font la marge et ceux qui la plombent","05/04/2026","Gestion","Tous les plats d'un menu ne rapportent pas la même marge. Le menu engineering aide les restaurateurs marocains à décider quoi garder, quoi promouvoir et quoi retirer.","Un menu de restaurant marocain peut comporter 30 à 50 références. Derrière chacune se cachent un coût de revient, un prix de vente et un volume de vente — et la combinaison de ces trois facteurs détermine la vraie contribution de chaque plat à la marge globale. La plupart des restaurateurs n'ont pas cette vision : ils gèrent le menu par habitude et par intuition.

Le menu engineering classe les plats en quatre catégories : les stars (marge haute, fort volume), les vaches à lait (marge haute, volume faible), les puzzles (marge basse, fort volume) et les poids morts (marge et volume faibles). Chaque catégorie appelle une décision différente : promouvoir les stars, fidéliser les vaches à lait, améliorer ou reformuler les puzzles, et éliminer les poids morts.

Appliquer cette méthode au contexte marocain demande de connaître le coût réel de chaque plat — ingrédients, portion, perte en cuisine. Beaucoup de restaurateurs découvrent en faisant cet exercice que certains plats populaires sont en réalité peu rentables, et que des ajustements de portion ou de prix peuvent transformer le résultat mensuel.

INVOOCoffee permet de configurer les coûts et prix de vente par produit, d'analyser les ventes par catégorie et de générer des rapports de marge par plat pour les cafés et restaurants marocains qui veulent piloter leur menu avec des données réelles.",""
"formation-personnel-restaurant-maroc-2026","Former le personnel d'un restaurant au Maroc : les bases qui font la différence en salle et en cuisine","05/04/2026","Restaurant","Dans la restauration marocaine, la qualité du service dépend autant de la formation du personnel que de la qualité des plats. Les bases à mettre en place dès l'ouverture.","Un bon restaurant au Maroc peut perdre des clients à cause d'un service en salle désorganisé, même si la cuisine est excellente. La formation du personnel n'est pas un luxe réservé aux grandes enseignes : ce sont des habitudes simples à ancrer dès les premiers jours — accueil, prise de commande, annonce des plats, gestion des réclamations.

La formation à la gestion de caisse est souvent bâclée. Un serveur qui ne sait pas comment fonctionner le système POS en heure de pointe crée des files d'attente et des erreurs de facturation. 30 minutes de formation pratique sur le logiciel de caisse évitent des heures de confusion pendant le service.

L'hygiène alimentaire est le volet le plus réglementé. Les manipulateurs d'aliments doivent respecter des règles précises de conservation, de nettoyage et de traçabilité. Une contamination alimentaire dans un établissement marocain peut non seulement entraîner une fermeture administrative mais aussi détruire la réputation en quelques heures sur les réseaux sociaux.

INVOOCoffee propose une interface de prise de commande intuitive que le personnel maîtrise en quelques minutes, réduisant les erreurs en salle et en cuisine et libérant du temps pour soigner l'expérience client au restaurant marocain.",""
"livraison-restaurant-maroc-organiser-flux-2026","Livraison à domicile pour restaurant au Maroc : comment organiser le flux sans perturber le service en salle","05/04/2026","Restaurant","La livraison représente une opportunité de CA supplémentaire pour les restaurants marocains — mais mal gérée, elle perturbe le service en salle. Comment équilibrer les deux.","La livraison à domicile a explosé au Maroc, portée par les plateformes numériques et par une demande client qui ne faiblit pas. Pour un restaurant qui fait déjà tourner une salle à pleine capacité à l'heure du déjeuner, accepter des commandes en ligne peut se transformer en chaos si l'organisation en cuisine n'est pas adaptée.

La première règle est de séparer les flux commande salle et commande livraison en cuisine. Si le chef doit jongler entre les deux sans organisation claire, les temps de sortie s'allongent, les plats se confondent et la qualité baisse des deux côtés. Un espace ou une plage horaire dédié à la livraison change radicalement l'expérience.

Le choix de proposer la livraison en direct ou via une plateforme (Glovo, Jumia Food) a des implications sur la marge : les plateformes prélèvent entre 15 et 30 % de commission. Pour les restaurants qui ont leur propre clientèle fidèle, la livraison directe via WhatsApp ou un système de réservation propre préserve mieux la marge.

INVOOCoffee intègre les commandes livraison dans le même flux que les commandes en salle — avec bons cuisine distincts, suivi par statut et facturation automatique — pour que le restaurant marocain gère les deux canaux sans perdre le contrôle.",""
"avis-clients-restaurant-maroc-reputation-2026","Avis clients et réputation en ligne pour un restaurant marocain : ce qui se passe si on ne gère pas","05/04/2026","Stratégie","Un avis négatif non répondu coûte des clients à un restaurant marocain. Comment gérer sa réputation en ligne sans y passer des heures et transformer les avis en outil de croissance.","En 2026, un client qui cherche un restaurant à Casablanca, Marrakech ou Agadir regarde d'abord Google Maps et les avis. Un établissement avec 4,2 étoiles et des réponses soignées aux commentaires génère systématiquement plus de trafic qu'un concurrent avec 3,8 étoiles et aucune réponse — même si la cuisine est meilleure.

Répondre aux avis négatifs n'est pas une admission de faute. C'est une démonstration publique que vous écoutez vos clients et que vous cherchez à vous améliorer. Un message court, professionnel et empathique transforme souvent un avis négatif en signal positif pour les lecteurs qui n'étaient pas présents.

Solliciter activement les avis positifs est une stratégie légale et efficace. Un QR code sur la table ou sur le ticket de caisse invitant à laisser un avis Google peut multiplier par trois le rythme de collecte d'avis. Les clients satisfaits ne pensent pas spontanément à laisser un avis — il suffit de le leur rappeler au bon moment.

INVOOCoffee intègre des options de fidélisation et de collecte de feedback client pour les cafés et restaurants marocains qui veulent transformer leur base de clients satisfaits en ambassadeurs actifs sur les moteurs de recherche.",""
"cout-revient-plat-maroc-calculer-2026","Calculer le coût de revient d'un plat au Maroc : méthode simple pour maîtriser sa marge en cuisine","05/04/2026","Gestion","Sans calcul du coût de revient, un restaurateur marocain fixe ses prix à l'intuition et peut vendre à perte sans le savoir. La méthode en 4 étapes pour y voir clair.","Beaucoup de restaurateurs marocains fixent leurs prix en regardant ce que fait la concurrence. C'est une erreur fréquente : le concurrent a peut-être des fournisseurs différents, un loyer plus bas ou une qualité d'ingrédients différente. Le seul prix qui garantit la rentabilité est celui qui est basé sur votre propre coût de revient.

Calculer le coût d'un plat se fait en quatre étapes : lister tous les ingrédients de la recette avec leurs quantités précises, multiplier par le prix d'achat unitaire de chaque ingrédient, ajouter un coefficient de perte en cuisine (épluchage, cuisson, découpe) et additionner le tout pour obtenir le coût matière du plat.

Une fois ce coût connu, appliquer un coefficient multiplicateur standard — entre 3 et 4 pour la restauration marocaine selon le positionnement — donne un prix de vente qui couvre les charges et dégage une marge. Si le prix obtenu est au-dessus du marché, c'est un signal pour retravailler la recette ou revoir les fournisseurs.

INVOOCoffee permet de configurer les fiches recettes avec coûts d'ingrédients, de calculer automatiquement le coût de revient par plat et de suivre l'évolution des marges en temps réel quand les prix fournisseurs changent au Maroc.",""
"gestion-caisse-cafe-maroc-ecart-clôture-2026","Clôture de caisse et écarts dans un café marocain : comprendre, prévenir et corriger","05/04/2026","POS & Caisse","Un écart de caisse quotidien dans un café marocain peut signifier une erreur ou un problème plus grave. Comment organiser la clôture et traiter les écarts proprement.","La clôture de caisse quotidienne est un moment clé pour tout café ou restaurant marocain. Elle devrait prendre 5 minutes et confirmer que le solde physique correspond au solde théorique du logiciel. En réalité, beaucoup d'établissements accumulent des écarts non expliqués qui faussent les comptes sur la durée.

Les causes les plus fréquentes d'écarts de caisse : erreurs de rendu monnaie, annulations non enregistrées dans le logiciel, consommations du personnel non tracées, et — moins fréquemment mais réellement — petites disparitions non documentées. Identifier la cause est la première étape pour corriger.

Une procédure de clôture structurée réduit considérablement ces écarts. Elle doit inclure : comptage physique par coupure, comparaison avec le total théorique du POS, enregistrement systématique de l'écart même s'il est faible, et validation par une deuxième personne pour les montants dépassant un seuil défini.

INVOOCoffee génère un rapport de clôture automatique avec calcul de l'écart, historique des annulations et détail des encaissements par mode de paiement — pour que chaque journée se termine avec une caisse transparente au café ou restaurant marocain.",""
"fidélisation-client-cafe-maroc-recurrence-2026","Fidéliser les clients d'un café au Maroc : techniques simples pour transformer les habitués en revenus stables","05/04/2026","Stratégie","Dans un café marocain, 20 % des clients fidèles représentent souvent 60 % du CA. Comment les identifier, les valoriser et créer les conditions de leur retour.","Dans un café marocain bien établi, les clients réguliers sont le pilier du chiffre d'affaires. Ils n'ont pas besoin d'être convaincus, ils connaissent la carte, et ils amènent leurs proches. Pourtant, peu de cafés investissent dans des actions concrètes de fidélisation — au-delà du « merci, à demain » du patron.

Les programmes de fidélité n'ont pas besoin d'être complexes. Une carte de fidélité physique — 10 cafés achetés, le 11e offert — fonctionne encore très bien au Maroc pour ancrer l'habitude de revenir. La numérisation de ce système, via une application ou un QR code, ajoute de la traçabilité sans changer le principe.

La personnalisation fait la différence. Un patron de café qui se souvient que son client habituel prend un café sans sucre et lit sa presse le matin crée une relation qu'aucune chaîne ne peut reproduire. Former le personnel à retenir ces détails — ou à les noter — transforme l'expérience et justifie un prix légèrement supérieur à la concurrence.

INVOOCoffee centralise l'historique des visites et des commandes par client fidélisé, avec outils de suivi de fréquence et tableaux de bord de récurrence pour les cafés marocains qui veulent construire une base de revenus prévisibles.",""
"approvisionnement-restaurant-maroc-fournisseurs-2026","Approvisionnement d'un restaurant au Maroc : choisir ses fournisseurs et négocier sans fragiliser la qualité","05/04/2026","Gestion","Les fournisseurs d'un restaurant marocain impactent directement la marge et la qualité. Comment structurer ses achats, négocier les prix et diversifier ses sources sans risque.","Les fournisseurs d'un restaurant au Maroc sont des partenaires stratégiques — mais des partenaires dont le prix et la fiabilité varient. Viande, légumes, produits laitiers, épices : chaque catégorie a ses propres dynamiques de prix, ses saisons et ses risques de rupture. Un restaurant qui dépend d'un seul fournisseur par catégorie est fragile.

Négocier avec ses fournisseurs ne signifie pas toujours obtenir le prix le plus bas. Dans la restauration marocaine, la régularité de la livraison, la qualité constante des produits et la flexibilité sur les petites commandes urgentes valent souvent plus qu'une remise de 5 %. Un bon fournisseur qui livre ponctuellement évite des pertes en cuisine bien plus coûteuses que la différence de prix.

Les achats au marché de gros restent courants pour les restaurateurs marocains, mais ils impliquent une gestion rigoureuse : factures à exiger systématiquement pour la déductibilité TVA, traçabilité des lots pour la sécurité alimentaire, et discipline dans les quantités achetées pour éviter le sur-stockage.

INVOOCoffee permet de suivre les achats par fournisseur, d'analyser l'évolution des coûts d'approvisionnement dans le temps et de détecter les postes où la marge se dégrade — pour que les décisions d'achat d'un restaurant marocain soient toujours éclairées.",""
"terrasse-cafe-maroc-optimiser-saison-2026","Terrasse de café au Maroc : comment maximiser le CA en saison et compenser en hiver","05/04/2026","Gestion","La terrasse d'un café marocain peut doubler le CA en été et représenter presque rien en hiver. Comment exploiter au maximum la belle saison et créer des revenus alternatifs le reste de l'année.","Dans les cafés marocains des grandes villes côtières et des médinas touristiques, la terrasse est souvent le moteur principal du chiffre d'affaires de juin à septembre. Bien exploitée, elle peut représenter 40 à 60 % du CA annuel en seulement 4 mois. Mal gérée, elle génère du bruit sans rentabilité.

Maximiser la terrasse en saison, c'est d'abord optimiser la capacité et le flux : agencement des tables pour maximiser le nombre de couverts sans sacrifier le confort, service rapide pour augmenter le taux de rotation, et une carte simplifiée qui permet à la cuisine de tenir la cadence. Un service lent en terrasse coûte des tables et des avis négatifs.

En basse saison, les cafés marocains qui résistent le mieux sont ceux qui ont développé une offre intérieure attractive — ambiance soignée, carte chaude, connexion wifi, espace de travail — et une clientèle locale fidèle qui ne dépend pas du tourisme. La terrasse d'été et le salon d'hiver sont deux produits complémentaires dans le même établissement.

INVOOCoffee analyse les ventes par période, par zone (salle ou terrasse) et par catégorie de produits pour que les gérants de cafés marocains prennent les bonnes décisions à chaque saison sur leur prix, leur carte et leur organisation.",""
