"id","title","date","tag","excerpt","body","published"
"facture-proforma-maroc-usage-export-2026","Facture proforma au Maroc : utilité, usage à l'export et différence avec la facture définitive","05/04/2026","Facturation","La facture proforma est indispensable pour les opérations d'import-export au Maroc. Comprendre son rôle évite les blocages douaniers et les malentendus commerciaux.","La facture proforma n'est pas une facture comptable : elle ne déclenche ni paiement ni enregistrement dans les livres. Elle sert avant tout à informer l'acheteur du prix, des conditions et du contenu d'une livraison à venir — et c'est souvent le document exigé par la douane marocaine pour les opérations d'import-export avant l'émission de la facture définitive.

Dans les échanges commerciaux internationaux impliquant des entreprises marocaines, la proforma est également utilisée pour débloquer les transferts de devises ou obtenir des lettres de crédit. Un document mal structuré ou manquant de mentions clés peut bloquer une transaction pendant plusieurs jours.

La différence essentielle avec la facture définitive : la proforma n'a pas de numéro séquentiel obligatoire, ne génère pas de TVA et ne s'intègre pas dans la comptabilité. Elle doit néanmoins mentionner clairement qu'il s'agit d'une proforma pour éviter toute confusion.

INVOOffice permet de générer des factures proforma distinctes des factures commerciales, avec conversion en facture définitive en un clic, pour fluidifier les échanges à l'export depuis le Maroc.",""
"note-honoraires-maroc-profession-liberale-2026","Note d'honoraires au Maroc : comment la rédiger correctement en profession libérale","05/04/2026","Facturation","Médecins, avocats, consultants : la note d'honoraires a ses propres règles au Maroc. Mentions obligatoires, TVA et archivage — le guide pour les professions libérales.","Les professions libérales au Maroc n'émettent pas toujours une facture au sens commercial du terme — elles émettent une note d'honoraires. La différence n'est pas que sémantique : certaines professions sont exonérées de TVA (médecins, chirurgiens-dentistes), d'autres l'appliquent au taux normal de 20 % (consultants, architectes, experts-comptables).

Une note d'honoraires conforme doit mentionner la nature précise de la prestation, la période concernée, les coordonnées complètes du prestataire incluant l'IF et l'ICE, et le traitement TVA applicable. L'absence de ces éléments peut créer des problèmes lors de la déduction chez le client ou lors d'un contrôle de la DGI.

L'archivage est souvent négligé par les indépendants : la loi marocaine impose une conservation de 10 ans. Garder des copies papier dans un tiroir n'est pas une stratégie d'archivage — surtout quand la DGI peut demander un justificatif pour une prestation facturée 7 ans auparavant.

INVOOffice accompagne les professions libérales marocaines avec des modèles de notes d'honoraires configurables selon le statut TVA, une numérotation automatique et un archivage numérique structuré par période fiscale.",""
"paiement-echeancier-maroc-client-pme-2026","Paiement en plusieurs fois au Maroc : structurer un échéancier client sans risque","05/04/2026","Gestion & Trésorerie","Proposer un échéancier à un client marocain sans documentation solide, c'est prendre un risque. Comment structurer les paiements différés pour rester payé et protégé.","Accorder un paiement en plusieurs fois à un client au Maroc est courant, surtout dans les services B2B. Mais sans document écrit précisant les montants, les dates et les conditions de chaque versement, l'accord verbal est fragile : difficile à faire valoir en cas de litige, impossible à comptabiliser correctement.

Un bon échéancier doit être annexé au contrat ou mentionné directement sur la facture : montant de l'acompte, dates des versements intermédiaires, solde à la livraison ou à la réception. Chaque versement partiel doit donner lieu à une quittance ou une facture d'acompte — pas seulement un virement noté mentalement.

Côté trésorerie, un échéancier bien documenté permet d'intégrer les entrées prévues dans les prévisions d'encaissement. On sait exactement quand l'argent arrive — ou quand il est en retard, déclenchant une relance ciblée plutôt qu'une relance générale.

INVOOffice permet de structurer des factures avec acomptes et échéances multiples, de suivre les versements reçus par dossier client et d'automatiser les relances selon les dates d'échéance définies.",""
"controle-fiscal-dgi-maroc-preparer-dossier-2026","Contrôle fiscal DGI Maroc : comment préparer son dossier et répondre sereinement","05/04/2026","Conformité DGI","La DGI Maroc peut solliciter vos justificatifs à tout moment. Anticiper la cohérence entre factures, déclarations et comptabilité est la meilleure préparation possible.","Un contrôle de la DGI au Maroc n'arrive pas toujours avec un préavis long. Quand l'administration demande des justificatifs, elle s'attend à trouver une cohérence parfaite entre les factures émises, les déclarations de TVA, les relevés bancaires et les livres comptables. Tout écart — même involontaire — devient un point d'interrogation qui demande une explication.

Les entreprises qui subissent des redressements ne sont pas forcément celles qui ont fraudé : ce sont souvent celles dont la documentation est incomplète, dont la numérotation des factures a des trous, ou dont les avoirs n'ont pas été correctement enregistrés. La forme compte autant que le fond.

Préparer son dossier, c'est s'assurer que pour chaque facture émise, il existe un bon de commande ou contrat correspondant, que chaque avoir est relié à sa facture d'origine, et que les déclarations TVA correspondent exactement aux totaux facturés sur la période.

INVOOffice structure la facturation marocaine dans un flux traçable et cohérent — numérotation séquentielle, avoirs rattachés, exports par période fiscale — pour que chaque réponse à la DGI prenne des minutes, pas des jours.",""
"devis-accepte-maroc-convertir-facture-2026","Du devis accepté à la facture au Maroc : comment éviter la double saisie et les erreurs","05/04/2026","Facturation","Retaper un devis accepté en facture est une source d'erreurs et de temps perdu. La bonne pratique pour les PME marocaines qui veulent aller vite sans se tromper.","Dans beaucoup de PME marocaines, le devis est saisi dans un fichier, le client valide par WhatsApp, et la facture est retapée manuellement dans un autre fichier. Ce processus en deux étapes génère des erreurs de montant, des oublis de références et des pertes de temps qui s'accumulent semaine après semaine.

La bonne pratique est simple : devis et facture partagent les mêmes données. Quand le client confirme, on transforme le devis en facture sans ressaisir une ligne — le prix, la désignation, la TVA et les coordonnées sont déjà là. Le numéro de devis devient une référence sur la facture pour assurer la traçabilité.

Cette fluidité réduit aussi le délai entre la validation du client et l'envoi de la facture. Moins de délai, c'est un encaissement plus rapide — et une trésorerie qui respire mieux. Pour les PME marocaines qui gèrent plusieurs devis par semaine, le gain est immédiat.

INVOOffice transforme un devis validé en facture conforme en un clic, avec reprise automatique de toutes les lignes, application de la TVA Maroc et archivage lié des deux documents pour une traçabilité complète.",""
"relance-impaye-maroc-etapes-recouvrement-2026","Impayés au Maroc : étapes de relance et options de recouvrement pour les PME","05/04/2026","Gestion & Trésorerie","Un impayé non géré rapidement devient une créance irrécouvrable. Les étapes concrètes de relance et les options légales disponibles pour les PME marocaines.","Au Maroc, les délais de paiement dans le B2B peuvent dépasser 90 jours dans certains secteurs. Quand un client ne paie pas à l'échéance, chaque semaine d'attente réduit statistiquement les chances de recouvrement. Agir vite et de façon structurée est la seule stratégie efficace.

La première relance — par message ou appel — doit intervenir dès le lendemain de l'échéance, avec un ton neutre et factuel. Si elle reste sans réponse, une deuxième relance plus formelle par email, avec copie de la facture, intervient à J+7. À J+21, un courrier recommandé de mise en demeure fixe une dernière date limite avant action.

Si le dialogue est rompu, les options légales au Maroc incluent la procédure d'injonction de payer devant le tribunal de commerce — une voie rapide et peu coûteuse pour les créances documentées. Un dossier avec factures originales, bons de commande et historique de relances facilite énormément cette démarche.

INVOOffice centralise l'historique de chaque facture avec ses relances, génère des modèles de courrier de mise en demeure et permet d'exporter un dossier complet par client pour faciliter toute démarche de recouvrement au Maroc.",""
"bilan-annuel-pme-maroc-preparer-comptable-2026","Bilan annuel au Maroc : comment préparer vos documents pour votre comptable sans stress","05/04/2026","Conformité DGI","La clôture comptable annuelle est moins douloureuse quand les données sont organisées tout au long de l'année. Ce que le comptable attend de votre PME au Maroc.","Chaque année, de nombreux dirigeants de PME marocaines passent des heures à chercher des factures, reconstituer des achats ou expliquer des écarts à leur comptable. Cette course de fin d'année est évitable — à condition d'organiser les données en continu plutôt qu'en une fois.

Ce que votre comptable attend en priorité : toutes les factures de vente avec leur date d'encaissement réelle, tous les achats avec TVA déductible justifiée, les relevés bancaires complets et les notes de frais. Plus ces éléments sont structurés et accessibles, moins la clôture coûte cher en honoraires.

Les PME qui utilisent un logiciel de facturation adapté au Maroc peuvent exporter en quelques minutes l'ensemble de leurs données par période — ventes, achats, TVA collectée et déductible — dans un format que le comptable peut intégrer directement. Le gain de temps est partagé des deux côtés.

INVOOffice produit des exports comptables par période, avec ventilation TVA, liste des factures et avoirs, et état des encaissements — pour que la relation avec votre comptable au Maroc soit fluide à chaque clôture.",""
"logiciel-facturation-maroc-criteres-choix-2026","Choisir un logiciel de facturation au Maroc : les critères qui comptent vraiment pour une PME","05/04/2026","Stratégie","Face aux nombreuses options disponibles, comment choisir le bon logiciel de facturation pour une PME ou TPE marocaine ? Les critères essentiels à ne pas négliger.","Le marché des logiciels de facturation au Maroc s'est étoffé ces dernières années, avec des solutions internationales et des outils locaux. Mais tous ne sont pas adaptés aux spécificités marocaines : taux de TVA multiples, mentions ICE et IF obligatoires, conformité DGI, et la réalité des connexions internet parfois instables dans certaines zones.

Le premier critère à évaluer est la conformité locale : le logiciel gère-t-il les taux de TVA marocains par catégorie, génère-t-il des factures avec toutes les mentions légales requises, et ses exports sont-ils exploitables pour les déclarations fiscales ? Un outil générique adapté à l'Europe peut créer plus de problèmes qu'il n'en résout.

Le deuxième critère souvent oublié est la continuité de service sans internet. Les coupures existent — surtout hors des grandes villes. Un logiciel qui s'arrête quand la connexion tombe n'est pas fiable pour une gestion quotidienne. Les données doivent également rester accessibles et sécurisées localement.

INVOOffice est conçu spécifiquement pour les PME et TPE marocaines : conformité DGI native, fonctionnement hors ligne, données hébergées localement et support en français et en arabe pour une prise en main rapide.",""
"gestion-multi-activite-pme-maroc-2026","PME multi-activité au Maroc : gérer facturation et TVA quand on opère dans plusieurs secteurs","05/04/2026","Fiscalité","Une PME marocaine qui cumule activités de service, commerce et location doit gérer plusieurs taux de TVA et règles fiscales. Comment s'y retrouver sans erreur.","Certaines PME marocaines exercent plusieurs activités en parallèle : une agence qui fait de la location de véhicules, du transport occasionnel et de la vente de pièces détachées, par exemple. Chaque activité peut relever d'un taux de TVA différent, d'un régime comptable distinct et d'obligations déclaratives spécifiques.

La principale difficulté est de ne pas mélanger les taux et les règles entre les activités. Facturer une location au taux de 20 % alors qu'une activité de transport relève de 14 % crée des incohérences qui se retrouveront dans les déclarations. La DGI peut y voir une erreur de bonne foi — ou une irrégularité à rectifier.

L'organisation est la clé : séparer clairement les lignes de facturation par activité, paramétrer les taux corrects dans l'outil de gestion, et s'assurer que les exports comptables distinguent bien les différents flux. Une comptabilité analytique simple par activité aide aussi à mesurer la rentabilité réelle de chaque pôle.

INVOOffice permet de configurer plusieurs activités avec des taux de TVA distincts, de segmenter les rapports par ligne d'activité et de produire des exports différenciés pour simplifier les déclarations des PME marocaines multi-secteurs.",""
"archivage-factures-maroc-obligations-2026","Archivage des factures au Maroc : durée légale, format accepté et bonnes pratiques numériques","05/04/2026","Conformité DGI","Au Maroc, les factures doivent être conservées 10 ans. Format papier ou numérique, organisation par période : ce que la loi exige et comment s'y conformer facilement.","L'obligation d'archivage des factures au Maroc est fixée à 10 ans à compter de la date d'émission par le Code Général des Impôts. Cela signifie qu'une facture émise en 2016 doit encore être disponible aujourd'hui si la DGI en fait la demande lors d'un contrôle. Beaucoup de dirigeants l'ignorent jusqu'au moment où c'est trop tard.

La DGI accepte les archives numériques à condition que les documents soient lisibles, intègres et traçables. Un scan de mauvaise qualité ou un fichier corrompu ne vaut pas grand-chose comme justificatif. L'idéal est de conserver les originaux numériques — les PDF générés par votre logiciel de facturation — organisés par exercice fiscal.

L'archivage physique (classeurs papier) reste courant au Maroc mais présente des risques évidents : incendie, inondation, perte lors d'un déménagement. La combinaison d'un stockage local et d'une sauvegarde régulière sur un support externe ou un service cloud fiable est la solution la plus robuste.

INVOOffice archive automatiquement chaque document émis dans un historique structuré par date, client et période fiscale — accessible en quelques secondes, exportable en PDF et conforme aux attentes de la DGI Maroc pendant toute la durée légale.",""
"prix-location-voiture-maroc-fixer-tarifs-2026","Comment fixer les prix de location de voiture au Maroc : méthode et grille tarifaire","05/04/2026","Rentabilité","Fixer ses tarifs de location de voiture au Maroc sans perdre de marge ni perdre des clients : méthode concrète basée sur les coûts réels et le marché local.","Fixer un tarif de location de voiture au Maroc ne se fait pas en regardant ce que fait le voisin. Un prix trop bas couvre à peine les charges et épuise la trésorerie en haute saison. Un prix trop élevé vide le planning en basse saison. La bonne méthode part des coûts réels : amortissement, assurance, vignette, entretien et carburant pour chaque véhicule, divisés par le nombre de jours de location espérés.

La grille tarifaire doit distinguer la courte durée (1 à 3 jours), la semaine et le long terme. Les remises progressives pour les durées longues fidélisent les clients entreprises — un segment plus stable que le touriste de passage. La saison touristique, notamment de juin à septembre, justifie une majoration tarifaire de 20 à 40 % selon les modèles.

Les frais annexes — livraison à domicile, deuxième conducteur, GPS, siège enfant — sont souvent sous-tarifés dans les petites agences marocaines. Bien les valoriser améliore le panier moyen sans modifier le tarif de base.

INVOOffice permet aux agences de location marocaines de configurer des grilles tarifaires par véhicule et par durée, de calculer la rentabilité réelle de chaque modèle et d'ajuster les prix à chaque saison sans tout ressaisir.",""
"etat-des-lieux-vehicule-maroc-litiges-2026","État des lieux de véhicule au Maroc : comment l'organiser pour éviter les litiges clients","05/04/2026","Location","L'état des lieux est la première protection de l'agence de location en cas de litige. Comment le rendre irréfutable et rapide à réaliser au Maroc.","Un rayure non notée au départ devient un litige à l'arrivée. Dans les agences de location de voitures au Maroc, la plupart des conflits clients naissent d'un état des lieux bâclé — ou inexistant. Le locataire dit que c'était déjà là, l'agence dit le contraire, et sans preuve écrite, la discussion tourne en rond.

Un état des lieux solide se fait en deux exemplaires signés par les deux parties, avec une liste précise des zones du véhicule (capot, ailes, portes, intérieur, pare-chocs) et une mention explicite de chaque défaut existant. Des photos horodatées complètent le document et l'objectivement. Cette procédure prend 5 à 10 minutes — elle économise des heures de litige.

A la restitution, le même document sert de référence. Si un dommage nouveau est constaté, le locataire a signé un état propre au départ : la franchise s'applique. Sans ce document, récupérer le coût d'une réparation devient très difficile, même avec une bonne assurance.

INVOOffice intègre un module d'état des lieux numérique avec schéma du véhicule, zones à cocher, ajout de photos et signature électronique — pour que chaque location au Maroc démarre et se termine avec un dossier propre et opposable.",""
"assurance-location-voiture-maroc-options-2026","Assurance pour agence de location de voitures au Maroc : options, franchises et couvertures à connaître","05/04/2026","Location","Choisir la bonne assurance pour sa flotte de location au Maroc : responsabilité civile, tous risques, franchises et options pour protéger l'agence sans sur-assurer.","Pour une agence de location de voitures au Maroc, l'assurance est à la fois une obligation légale et un outil de gestion du risque. La responsabilité civile est le minimum requis, mais en location elle est largement insuffisante : elle ne couvre pas les dommages sur vos propres véhicules, qui sont votre principal actif.

La tous risques avec franchise est la couverture standard des agences structurées. Le niveau de franchise est une décision financière : une franchise élevée réduit la prime annuelle mais expose l'agence à des décaissements fréquents sur les petits sinistres. Pour une flotte de 10 véhicules avec un historique de sinistralité faible, une franchise intermédiaire est souvent le bon équilibre.

Certains assureurs marocains proposent des contrats flotte avec couverture conducteur incluse — particulièrement utile quand c'est le locataire qui est au volant. D'autres offrent des options d'assistance dépannage 24h/24 qui réduisent l'impact des pannes sur l'expérience client et sur votre organisation.

INVOOffice centralise les informations d'assurance de chaque véhicule avec alertes d'expiration, historique des sinistres et suivi des coûts par dossier, pour que chaque décision de renouvellement soit prise avec les bonnes données.",""
"agence-location-maroc-clients-entreprises-2026","Développer la clientèle entreprise pour une agence de location au Maroc : stratégie et fidélisation","05/04/2026","Location","Les clients entreprises sont les plus stables pour une agence de location au Maroc. Comment les identifier, les approcher et les fidéliser avec des conditions adaptées.","Les entreprises — PME locales, multinationales, hôtels, administrations — représentent un segment de clientèle beaucoup plus stable que le tourisme pour une agence de location au Maroc. Elles louent tout au long de l'année, pas seulement en haute saison. Et quand elles font confiance à une agence, elles restent fidèles, parfois plusieurs années.

Approcher ce segment demande une proposition adaptée : tarifs négociés sur volume, facturation mensuelle consolidée, véhicules de remplacement disponibles rapidement, et un interlocuteur dédié. Ces clients ont des exigences de service plus élevées mais acceptent des prix plus stables — et moins de pression sur les tarifs journaliers.

La fidélisation passe par la fiabilité : véhicule propre et ponctuel, facture juste et conforme, réponse rapide aux demandes. Un dossier client bien tenu — avec historique des locations, documents à jour et contacts clés — évite les frictions à chaque nouvelle réservation et donne à l'entreprise envie de revenir.

INVOOffice structure les comptes clients entreprises avec historique complet des locations, facturation groupée mensuelle et suivi des contrats cadres pour les agences de location marocaines qui veulent développer ce segment.",""
"gps-telematics-flotte-maroc-2026","Géolocalisation et télématique pour flotte au Maroc : ce que ça change vraiment pour une agence","05/04/2026","Gestion flotte","Installer des traceurs GPS sur sa flotte de location au Maroc : avantages concrets, limites légales et comment l'intégrer dans sa politique client.","Les boîtiers GPS et les solutions de télématique se démocratisent dans les flottes marocaines. Pour une agence de location, les bénéfices sont concrets : localisation d'un véhicule en cas de non-retour, vérification du kilométrage réel déclaré par le locataire, alerte en cas de sortie de zone géographique autorisée, et récupération facilitée en cas de vol.

Mais l'installation d'un traceur GPS sur un véhicule loué soulève une question légale et commerciale : le locataire doit être informé. En pratique, la mention dans le contrat de location suffit dans la plupart des cas. Ce qui ne se fait pas, c'est la surveillance en temps réel sans en avoir informé le client — cela crée des risques juridiques.

La télématique va plus loin que la localisation : elle peut mesurer le style de conduite (accélérations brusques, freinages), détecter les anomalies moteur à distance et optimiser les tournées de récupération. Pour une flotte de plus de 20 véhicules, le retour sur investissement est souvent atteint en quelques mois grâce à la réduction des sinistres et des coûts de maintenance.

INVOOffice s'intègre avec les principales solutions de géolocalisation du marché marocain pour centraliser les données de flotte — kilométrage réel, alertes de zone et historique de localisation — dans un tableau de bord unique.",""
"renouvellement-flotte-maroc-quand-vendre-2026","Renouvellement de flotte au Maroc : quand vendre un véhicule et comment décider sans se tromper","05/04/2026","Rentabilité","Garder un véhicule trop longtemps en flotte de location au Maroc coûte plus cher que de le renouveler. Les indicateurs pour décider au bon moment.","La décision de vendre un véhicule de flotte est souvent repoussée par intuition — on hésite, on attend encore une saison. Pourtant, au-delà de 150 000 km ou de 5 ans d'exploitation intensive, les coûts de maintenance et les immobilisations pour réparation commencent à dépasser ce que le véhicule rapporte. Le garder revient plus cher que de le remplacer.

Les indicateurs à surveiller : taux d'utilisation sur les 6 derniers mois, coût de maintenance total sur 12 mois comparé au revenu généré, nombre de jours immobilisé pour réparation, et valeur de revente actuelle versus valeur future estimée. Un véhicule dont le ratio coûts/revenus dépasse 60 % est un candidat à la cession.

Le bon moment pour vendre est avant que les problèmes techniques deviennent visibles pour les acheteurs. Un véhicule en bon état apparent à 120 000 km se vend bien mieux qu'à 160 000 km avec des réparations récentes connues. Anticiper le renouvellement préserve la valeur résiduelle et finance partiellement le suivant.

INVOOffice suit les indicateurs de rentabilité par véhicule sur toute la durée d'exploitation — coûts cumulés, revenus générés, taux d'utilisation — pour que les décisions de renouvellement de flotte au Maroc soient basées sur des données, pas sur des intuitions.",""
